{
  "document_id": "tt-05-2024",
  "source_url": "https://datafiles.chinhphu.vn/cpp/files/vbpq/2024/4/05-bgtvt.signed.pdf",
  "downloaded_at": "2026-08-31T09:10:00+07:00",
  "file_hash": "8a90ff96c7a44f9a1dd675dc8251bff33a7579c6ebd020d654973c756a12b644",
  "document_number": "05/2024/TT-BGTVT",
  "document_type": "CIRCULAR",
  "issuer": "Bộ Giao thông vận tải",
  "issued_date": "2024-03-31",
  "effective_from": "2024-06-01",
  "effective_to": null,
  "status": "EFFECTIVE",
  "relation_notes": "Sửa đổi, bổ sung các thông tư về vận tải đường bộ, dịch vụ hỗ trợ vận tải đường bộ, phương tiện và người lái; relation candidate AMENDS các văn bản được liệt kê trong điều khoản sửa đổi, cần resolver xác nhận. Nguồn PDF chính thức datafiles.chinhphu.vn.",
  "review_status": "ACCEPTED",
  "reviewed_by": "Phuc Truong <phuctruong@student>",
  "reviewed_at": "2026-09-05T17:29:51Z"
}
