{
  "document_id": "nd-119-2024",
  "source_url": "https://datafiles.chinhphu.vn/cpp/files/vbpq/2024/9/119-cp.signed.pdf",
  "downloaded_at": "2026-08-26T09:00:00+07:00",
  "file_hash": "6d79ec19d1cf0eb420ccdec66a7867efa5420b1f9fdd5be80be7f946ba3e7d97",
  "document_number": "119/2024/NĐ-CP",
  "document_type": "DECREE",
  "issuer": "Chính phủ",
  "issued_date": "2024-09-30",
  "effective_from": "2024-10-01",
  "effective_to": null,
  "status": "EFFECTIVE",
  "relation_notes": "Quy định về thanh toán điện tử giao thông đường bộ; IMPLEMENTS Luật Đường bộ 35/2024/QH15 và Luật Trật tự, an toàn giao thông đường bộ 36/2024/QH15. Nguồn PDF chính thức datafiles.chinhphu.vn.",
  "review_status": "ACCEPTED",
  "reviewed_by": "Phuc Truong <phuctruong@student>",
  "reviewed_at": "2026-09-05T17:29:51Z"
}
