{
  "document_id": "nd-44-2024",
  "source_url": "https://datafiles.chinhphu.vn/cpp/files/vbpq/2024/5/44-cp.signed.pdf",
  "downloaded_at": "2026-08-26T09:00:00+07:00",
  "file_hash": "9ca9d540f801e9e4e752522ab4d92087a7567b2e8aeb5f3889024572c8259887",
  "document_number": "44/2024/NĐ-CP",
  "document_type": "DECREE",
  "issuer": "Chính phủ",
  "issued_date": "2024-04-24",
  "effective_from": "2024-06-10",
  "effective_to": null,
  "status": "EFFECTIVE",
  "relation_notes": "Quy định quản lý, sử dụng và khai thác tài sản kết cấu hạ tầng giao thông đường bộ; IMPLEMENTS Luật Đường bộ 35/2024/QH15. Nguồn PDF chính thức datafiles.chinhphu.vn.",
  "review_status": "ACCEPTED",
  "reviewed_by": "corpus-reviewer-01",
  "reviewed_at": "2026-09-06T00:00:00Z"
}
