{
  "document_id": "nd-236-2026",
  "source_url": "https://datafiles.chinhphu.vn/cpp/files/vbpq/2026/6/236-ndcp.signed.pdf",
  "downloaded_at": "2026-08-14T06:25:00+07:00",
  "file_hash": "7b89809792cc3656209b272918a2cd85f5997b3f84caf85a45868646661c9d4a",
  "document_number": "236/2026/NĐ-CP",
  "document_type": "DECREE",
  "issuer": "Chính phủ",
  "issued_date": "2026-06-26",
  "effective_from": "2026-07-01",
  "effective_to": null,
  "status": "EFFECTIVE",
  "relation_notes": "Nghị định 236/2026/NĐ-CP sửa đổi, bổ sung một số điều của Nghị định 151/2024/NĐ-CP (quy định chi tiết thi hành Luật TTATGTĐB 36/2024/QH15, đã được sửa đổi bởi NĐ 184/2025/NĐ-CP) — quan hệ AMENDS với nd-151-2024 trong batch-03 (Điều 1-16 sửa đổi, bổ sung, thay thế nhiều điều và phụ lục của NĐ 151/2024; Điều 18: hiệu lực từ 01/07/2026, riêng quy định xây dựng CSDL xe cơ giới nước ngoài và CSDL đơn vị kinh doanh vận tải/phù hiệu có hiệu lực 01/07/2027; Điều 17: điều khoản chuyển tiếp; Điều 19: trách nhiệm thi hành). PDF signed official từ vanban.chinhphu.vn (docid 218618).",
  "review_status": "ACCEPTED",
  "reviewed_by": "corpus-reviewer-01",
  "reviewed_at": "2026-08-14T07:25:00+07:00"
}
