{
  "document_id": "luat-36-2024-qh15",
  "source_url": "https://vbpl.vn/TW/Pages/vbpq-van-ban-goc.aspx?ItemID=36-2024-QH15",
  "downloaded_at": "2026-08-01T09:05:00+07:00",
  "file_hash": "9e387c099aa9af454e7082513011d8fe35c811693edfaf763d5494a6aa02ab99",
  "document_number": "36/2024/QH15",
  "document_type": "LAW",
  "issuer": "Quốc hội",
  "issued_date": "2024-06-27",
  "effective_from": "2025-01-01",
  "effective_to": null,
  "status": "EFFECTIVE",
  "relation_notes": "Văn bản gốc của Luật Trật tự, an toàn giao thông đường bộ 2024 (batch-01).",
  "review_status": "ACCEPTED",
  "reviewed_by": "reviewer-01",
  "reviewed_at": "2026-08-02T10:30:00+07:00"
}
