{
  "document_id": "tt-37-2026",
  "source_url": "https://datafiles.chinhphu.vn/cpp/files/vbpq/2026/4/37-bca.pdf",
  "downloaded_at": "2026-08-14T06:40:00+07:00",
  "file_hash": "16346e5ff280b0eda4d4bbee723560310b36917ee9a9fd74aee53c6f8f33265b",
  "document_number": "37/2026/TT-BCA",
  "document_type": "CIRCULAR",
  "issuer": "Bộ Công an",
  "issued_date": "2026-04-24",
  "effective_from": "2026-06-08",
  "effective_to": null,
  "status": "EFFECTIVE",
  "relation_notes": "Thông tư 37/2026/TT-BCA sửa đổi, bổ sung một số điều của các thông tư quy định về đăng ký, kiểm định phương tiện, trong đó Chương I sửa đổi, bổ sung Thông tư 79/2024/TT-BCA (đã được sửa đổi bởi TT 13/2025/TT-BCA) — quan hệ AMENDS với tt-79-2024 (Chương I); Điều 7: hiệu lực từ 08/06/2026 kèm điều khoản chuyển tiếp (giấy chứng nhận kiểm định cấp trước ngày hiệu lực vẫn còn giá trị). Mắt xích cuối chuỗi đăng ký xe: TT 79/2024 → TT 13/2025 → TT 51/2025 → TT 37/2026 (tt-51-2025 trong batch-03). PDF official từ vanban.chinhphu.vn (docid 217949).",
  "review_status": "ACCEPTED",
  "reviewed_by": "corpus-reviewer-01",
  "reviewed_at": "2026-08-14T07:40:00+07:00"
}
