{
  "document_id": "nd-238-2026",
  "source_url": "https://datafiles.chinhphu.vn/cpp/files/vbpq/2026/7/238-ndcp.signed.pdf",
  "downloaded_at": "2026-08-14T06:20:00+07:00",
  "file_hash": "f132e2e941d4b0d704b9790b65dc451c8642062624030cfc24f7c8186f5d7d21",
  "document_number": "238/2026/NĐ-CP",
  "document_type": "DECREE",
  "issuer": "Chính phủ",
  "issued_date": "2026-06-26",
  "effective_from": "2026-08-15",
  "effective_to": null,
  "status": "NOT_YET_EFFECTIVE",
  "relation_notes": "Nghị định 238/2026/NĐ-CP sửa đổi, bổ sung một số điều của Nghị định 168/2024/NĐ-CP về xử phạt VPHC trật tự, an toàn giao thông trong lĩnh vực giao thông đường bộ; trừ điểm, phục hồi điểm GPLX — quan hệ AMENDS với nd-168-2024 (Chương I, Điều 1-19 sửa đổi, bổ sung, bãi bỏ nhiều điều/khoản/điểm của NĐ 168/2024; Điều 20: hiệu lực từ 15/08/2026; Điều 21: điều khoản chuyển tiếp — hành vi xảy ra trước ngày hiệu lực áp dụng nghị định đang có hiệu lực tại thời điểm thực hiện). Tại ngày tải (14/08/2026) NĐ 238/2026 chưa có hiệu lực nên status = NOT_YET_EFFECTIVE. PDF signed official từ vanban.chinhphu.vn (docid 218613).",
  "review_status": "ACCEPTED",
  "reviewed_by": "corpus-reviewer-01",
  "reviewed_at": "2026-08-14T07:20:00+07:00"
}
