{
  "document_id": "tt-16-2024",
  "source_url": "https://datafiles.chinhphu.vn/cpp/files/vbpq/2024/6/16-bgtvt.pdf",
  "downloaded_at": "2026-08-26T09:00:00+07:00",
  "file_hash": "a1b9f9d29060c9a91b65d238cbb4bb0831aae569229cb692ee6fde7b61e2f28f",
  "document_number": "16/2024/TT-BGTVT",
  "document_type": "CIRCULAR",
  "issuer": "Bộ Giao thông vận tải",
  "issued_date": "2024-06-03",
  "effective_from": "2024-08-01",
  "effective_to": null,
  "status": "EFFECTIVE",
  "relation_notes": "Quy định về lựa chọn nhà đầu tư thực hiện dự án kinh doanh công trình trạm dừng nghỉ đường bộ; IMPLEMENTS Luật Đường bộ 35/2024/QH15. Nguồn PDF chính thức datafiles.chinhphu.vn.",
  "review_status": "ACCEPTED",
  "reviewed_by": "corpus-reviewer-01",
  "reviewed_at": "2026-09-06T00:00:00Z"
}
