{
  "document_id": "nd-168-2024",
  "source_url": "https://datafiles.chinhphu.vn/cpp/files/vbpq/2025/01/168-nd-cp.signed.pdf",
  "downloaded_at": "2026-08-09T09:00:00+07:00",
  "file_hash": "7bb11b939d162499ab404aa41a940cce05dbf071d9cbae7a8898b00d4b4a48bd",
  "document_number": "168/2024/NĐ-CP",
  "document_type": "DECREE",
  "issuer": "Chính phủ",
  "issued_date": "2024-12-26",
  "effective_from": "2025-01-01",
  "effective_to": null,
  "status": "EFFECTIVE",
  "relation_notes": "Nghị định 168/2024/NĐ-CP quy định xử phạt VPHC TTATGT đường bộ; thay thế quy định xử phạt TTATGT đường bộ của NĐ 100/2019 (Điều 52.8 bãi bỏ). PDF signed official từ vanban.chinhphu.vn (docid 212167).",
  "review_status": "ACCEPTED",
  "reviewed_by": "corpus-reviewer-01",
  "reviewed_at": "2026-08-09T10:00:00+07:00"
}
