{
  "document_id": "luat-35-2024-qh15",
  "source_url": "https://datafiles.chinhphu.vn/cpp/files/vbpq/2024/9/35-2024-qh15.pdf",
  "downloaded_at": "2026-08-09T09:25:00+07:00",
  "file_hash": "debf33ad3b4781c04c143b3b684aaace3e4ecc24110d87ca551ab1cd0221c9fc",
  "document_number": "35/2024/QH15",
  "document_type": "LAW",
  "issuer": "Quốc hội",
  "issued_date": "2024-06-27",
  "effective_from": "2025-01-01",
  "effective_to": null,
  "status": "EFFECTIVE",
  "relation_notes": "Luật Đường bộ 2024 — hiện hành từ 01/01/2025. Cùng luat-36-2024-qh15 thay thế phạm vi điều chỉnh trước đây của Luật Giao thông đường bộ 23/2008/QH12; luật 23/2008 là historical anchor ngoài batch-02. Bản hợp nhất hiện hành tương ứng: vbhn-49-2026-vpqh.",
  "review_status": "ACCEPTED",
  "reviewed_by": "corpus-reviewer-01",
  "reviewed_at": "2026-08-09T10:25:00+07:00"
}
