{
  "document_id": "nd-151-2024",
  "source_url": "https://datafiles.chinhphu.vn/cpp/files/vbpq/2024/12/151-cp.signed.pdf",
  "downloaded_at": "2026-08-14T06:30:00+07:00",
  "file_hash": "6ec6583812e0db65512e04babd30e03c3bf48bf9752a59a88804ac32929552d3",
  "document_number": "151/2024/NĐ-CP",
  "document_type": "DECREE",
  "issuer": "Chính phủ",
  "issued_date": "2024-11-15",
  "effective_from": "2025-01-01",
  "effective_to": null,
  "status": "EFFECTIVE",
  "relation_notes": "Nghị định 151/2024/NĐ-CP quy định chi tiết một số điều và biện pháp thi hành Luật Trật tự, an toàn giao thông đường bộ 36/2024/QH15 — quan hệ IMPLEMENTS với luat-36-2024-qh15 (căn cứ Luật 36/2024 ngày 27/06/2024; Điều 38.1 hiệu lực từ 01/01/2025). Điều 38.2 bãi bỏ (REPEALS) NĐ 109/2009/NĐ-CP (tín hiệu xe ưu tiên), NĐ 30/2024/NĐ-CP (xe cơ giới nước ngoài du lịch), NĐ 80/2009/NĐ-CP (ôtô tay lái phải) và một số điều/khoản của NĐ 10/2020/NĐ-CP (kinh doanh, điều kiện kinh doanh vận tải bằng xe ô tô, đã sửa đổi bởi NĐ 47/2022 và NĐ 41/2024). Hiện hành theo bản đã được sửa đổi, bổ sung bởi NĐ 184/2025/NĐ-CP (01/07/2025) và NĐ 236/2026/NĐ-CP (batch-03, hiệu lực 01/07/2026). PDF signed official từ vanban.chinhphu.vn (docid 211956).",
  "review_status": "ACCEPTED",
  "reviewed_by": "corpus-reviewer-01",
  "reviewed_at": "2026-08-14T07:30:00+07:00"
}
