{
  "document_id": "tt-79-2024",
  "source_url": "https://datafiles.chinhphu.vn/cpp/files/vbpq/2024/12/79-bca.signed.pdf",
  "downloaded_at": "2026-08-09T09:15:00+07:00",
  "file_hash": "3d7126e1b44e6f983e2352cabdebe513511b7d267cc4e125cad9afc8c5ee3e30",
  "document_number": "79/2024/TT-BCA",
  "document_type": "CIRCULAR",
  "issuer": "Bộ Công an",
  "issued_date": "2024-11-15",
  "effective_from": "2025-01-01",
  "effective_to": null,
  "status": "EFFECTIVE",
  "relation_notes": "Thông tư 79/2024/TT-BCA về cấp, thu hồi đăng ký xe — hiện hành; bãi bỏ toàn bộ TT 24/2023/TT-BCA từ 01/01/2025. PDF signed official từ vanban.chinhphu.vn (docid 211945).",
  "review_status": "ACCEPTED",
  "reviewed_by": "corpus-reviewer-01",
  "reviewed_at": "2026-08-09T10:15:00+07:00"
}
