{
  "document_id": "tt-51-2025",
  "source_url": "https://datafiles.chinhphu.vn/cpp/files/vbpq/2025/7/51-bca.signed.pdf",
  "downloaded_at": "2026-08-14T06:35:00+07:00",
  "file_hash": "aa06b8a5d0d71f6b44d5c64ff8ac4d4b5e5bd7b7348378e973ec0584fd3f61f3",
  "document_number": "51/2025/TT-BCA",
  "document_type": "CIRCULAR",
  "issuer": "Bộ Công an",
  "issued_date": "2025-06-30",
  "effective_from": "2025-07-01",
  "effective_to": null,
  "status": "EFFECTIVE",
  "relation_notes": "Thông tư 51/2025/TT-BCA sửa đổi, bổ sung một số điều của Thông tư 79/2024/TT-BCA về cấp, thu hồi chứng nhận đăng ký xe, biển số xe cơ giới, xe máy chuyên dùng (đã được sửa đổi, bổ sung tại TT 13/2025/TT-BCA) — quan hệ AMENDS với tt-79-2024 (Điều 1 sửa đổi, bổ sung nhiều điều của TT 79/2024; Điều 3: hiệu lực từ 01/07/2025). Mắt xích giữa chuỗi đăng ký xe: TT 79/2024 → TT 13/2025 → TT 51/2025 → TT 37/2026 (tt-37-2026 trong batch-03). PDF signed official từ vanban.chinhphu.vn (docid 214486).",
  "review_status": "ACCEPTED",
  "reviewed_by": "corpus-reviewer-01",
  "reviewed_at": "2026-08-14T07:35:00+07:00"
}
