{
  "document_id": "nd-158-2024",
  "source_url": "https://datafiles.chinhphu.vn/cpp/files/vbpq/2024/12/158_2024_nd-cp_18122024-signed.pdf",
  "downloaded_at": "2026-08-31T09:00:00+07:00",
  "file_hash": "2c9a9e4dbaebf415b33980370b3c184b50d1edc4b220b7f473674527a1c47fe5",
  "document_number": "158/2024/NĐ-CP",
  "document_type": "DECREE",
  "issuer": "Chính phủ",
  "issued_date": "2024-12-18",
  "effective_from": "2025-01-01",
  "effective_to": null,
  "status": "EFFECTIVE",
  "relation_notes": "Quy định về hoạt động vận tải đường bộ; thay thế Nghị định 10/2020/NĐ-CP và các văn bản sửa đổi liên quan, cần resolver xác nhận phạm vi thay thế provision-level. Nguồn PDF chính thức datafiles.chinhphu.vn.",
  "review_status": "ACCEPTED",
  "reviewed_by": "Phuc Truong <phuctruong@student>",
  "reviewed_at": "2026-09-05T17:29:51Z"
}
