{
  "document_id": "vbhn-49-2026-vpqh",
  "source_url": "https://datafiles.chinhphu.vn/cpp/files/vbpq/2026/3/49-vbhn-vpqh.pdf",
  "downloaded_at": "2026-08-09T09:30:00+07:00",
  "file_hash": "522db5de8613ada683bcf873ae99ccbd590e4c7a6f848e9d878e7a67ed0f8ba3",
  "document_number": "49/VBHN-VPQH",
  "document_type": "OTHER",
  "issuer": "Văn phòng Quốc hội",
  "issued_date": "2026-03-17",
  "effective_from": "2026-03-17",
  "effective_to": null,
  "status": "EFFECTIVE",
  "relation_notes": "Văn bản hợp nhất 49/VBHN-VPQH ngày 17/03/2026: bản hợp nhất của Luật Đường bộ 35/2024/QH15, bao gồm sửa đổi theo Luật 118/2025/QH15 (có hiệu lực 01/07/2026). RELATED_TO luat-35-2024-qh15; là bản hợp nhất phục vụ current-text retrieval, không phải văn bản thay thế luật gốc. Effective windows của từng provision phải theo luật gốc và các sự kiện sửa đổi.",
  "review_status": "ACCEPTED",
  "reviewed_by": "corpus-reviewer-01",
  "reviewed_at": "2026-08-09T10:30:00+07:00"
}
