{
  "document_id": "tt-18-2024",
  "source_url": "https://datafiles.chinhphu.vn/cpp/files/vbpq/2024/6/18-bgtvt.pdf",
  "downloaded_at": "2026-08-31T09:15:00+07:00",
  "file_hash": "fc871dea29f9629424e2749b078d00e08acbe4a234eae4d777e00a0b5dd58bf1",
  "document_number": "18/2024/TT-BGTVT",
  "document_type": "CIRCULAR",
  "issuer": "Bộ Giao thông vận tải",
  "issued_date": "2024-05-31",
  "effective_from": "2024-07-15",
  "effective_to": null,
  "status": "EFFECTIVE",
  "relation_notes": "Sửa đổi, bổ sung Thông tư 12/2020/TT-BGTVT về tổ chức, quản lý vận tải bằng xe ô tô và dịch vụ hỗ trợ vận tải đường bộ; relation candidate AMENDS, cần resolver xác nhận provision-level. Nguồn PDF chính thức datafiles.chinhphu.vn.",
  "review_status": "ACCEPTED",
  "reviewed_by": "corpus-reviewer-01",
  "reviewed_at": "2026-09-06T00:00:00Z"
}
