{
  "document_id": "nd-67-2023",
  "source_url": "https://datafiles.chinhphu.vn/cpp/files/vbpq/2023/9/67-cp.signed.pdf",
  "downloaded_at": "2026-08-31T09:05:00+07:00",
  "file_hash": "85daf36b0811c11299a0e05b28c4ba2afdd8f9216da1e8652136cf74d00b6933",
  "document_number": "67/2023/NĐ-CP",
  "document_type": "DECREE",
  "issuer": "Chính phủ",
  "issued_date": "2023-09-06",
  "effective_from": "2023-09-06",
  "effective_to": null,
  "status": "EFFECTIVE",
  "relation_notes": "Quy định bảo hiểm bắt buộc trách nhiệm dân sự của chủ xe cơ giới; quan hệ liên ngành với Luật Trật tự, an toàn giao thông đường bộ 36/2024/QH15 cần resolver xác nhận. Đã có Nghị định 220/2026/NĐ-CP sửa đổi, cần cập nhật hiệu lực provision-level. Nguồn PDF chính thức datafiles.chinhphu.vn.",
  "review_status": "ACCEPTED",
  "reviewed_by": "corpus-reviewer-01",
  "reviewed_at": "2026-09-06T00:00:00Z"
}
