{
  "document_id": "tt-51-2024",
  "source_url": "https://datafiles.chinhphu.vn/cpp/files/vbpq/2024/11/51-bgtvt.pdf",
  "downloaded_at": "2026-08-31T09:20:00+07:00",
  "file_hash": "dc822815eb51c6674a40ce91127b636f11a7479c76f24d9a00445dcf248b6689",
  "document_number": "51/2024/TT-BGTVT",
  "document_type": "CIRCULAR",
  "issuer": "Bộ Giao thông vận tải",
  "issued_date": "2024-11-15",
  "effective_from": "2025-01-01",
  "effective_to": null,
  "status": "EFFECTIVE",
  "relation_notes": "Ban hành QCVN 41:2024/BGTVT về báo hiệu đường bộ, thay thế QCVN 41:2019/BGTVT; relation candidate REPLACES, cần resolver xác nhận phạm vi và provision-level mapping. Nguồn PDF chính thức datafiles.chinhphu.vn.",
  "review_status": "ACCEPTED",
  "reviewed_by": "Phuc Truong <phuctruong@student>",
  "reviewed_at": "2026-09-05T17:29:51Z"
}
