{
  "document_id": "luat-36-2024-qh15",
  "source_url": "https://datafiles.chinhphu.vn/cpp/files/vbpq/2024/9/36-2024-qh15.pdf",
  "downloaded_at": "2026-08-09T09:10:00+07:00",
  "file_hash": "43c0a3f5af2fae8ccfbe88f4e78cb5a7060d6008f516e9fbe0de1aad67ca6f34",
  "document_number": "36/2024/QH15",
  "document_type": "LAW",
  "issuer": "Quốc hội",
  "issued_date": "2024-06-27",
  "effective_from": "2025-01-01",
  "effective_to": null,
  "status": "EFFECTIVE",
  "relation_notes": "Luật Trật tự, an toàn giao thông đường bộ 2024 — văn bản gốc hiện hành. PDF nguồn chính thức 2 phần (datafiles.chinhphu.vn/vbpq/2024/9/36-2024-qh15.pdf + 36-2024-qh15_tiep.pdf) đã merge thành data/luat-36-2024-qh15/source/luat-36-2024.pdf; file_hash = SHA-256 của file merged đầy đủ. Nguồn vanban.chinhphu.vn (docid 211194).",
  "review_status": "ACCEPTED",
  "reviewed_by": "corpus-reviewer-01",
  "reviewed_at": "2026-08-09T10:10:00+07:00"
}