{
  "document_id": "tt-39-2024",
  "source_url": "https://datafiles.chinhphu.vn/cpp/files/vbpq/2024/11/39-bgtvt.pdf",
  "downloaded_at": "2026-08-26T09:00:00+07:00",
  "file_hash": "69cc4eb4d469138d63348520fd7a849b26b20b8bc438b4f73f33b5f32b8de29f",
  "document_number": "39/2024/TT-BGTVT",
  "document_type": "CIRCULAR",
  "issuer": "Bộ Giao thông vận tải",
  "issued_date": "2024-11-15",
  "effective_from": "2025-01-01",
  "effective_to": null,
  "status": "EFFECTIVE",
  "relation_notes": "Quy định về tải trọng, khổ giới hạn đường bộ, lưu hành xe quá khổ giới hạn, xe quá tải trọng và vận chuyển hàng siêu trường, siêu trọng; IMPLEMENTS Luật Đường bộ 35/2024/QH15. Nguồn PDF chính thức datafiles.chinhphu.vn.",
  "review_status": "ACCEPTED",
  "reviewed_by": "corpus-reviewer-01",
  "reviewed_at": "2026-09-06T00:00:00Z"
}
